{
  "schema_version": "1.0.0",
  "task_id": "task_jh004_real_20261014_8b880432",
  "title": "JH-004 bounded real-host records transform",
  "description": "Sort the trusted input records by region ascending, then sales ascending. Deliver the sorted JSON list as the generated artifact; do not request tools or apply files.",
  "acceptance_criteria": [
    "Trusted input records were provided",
    "Artifact content equals the expected sorted records"
  ],
  "priority": "high",
  "status": "created",
  "risk_assessment": {
    "risk_level": "read_only",
    "complexity": "low",
    "uncertainty": "low",
    "risk_basis": "Synthetic data, generated artifact only, no user files or model tools",
    "routing_basis": "Fixed supported records_transform_v1 template"
  },
  "budget": {
    "max_turns": 6,
    "max_tokens": 16000,
    "max_execution_time_seconds": 600
  },
  "context": {
    "workspace_root": "D:\\JH-Agent OS\\data\\worktrees\\n1-artifact-entry\\data\\integration-evidence\\jh004-20261014\\ws",
    "target_files": []
  },
  "artifact_refs": [],
  "tool_execution_evidence": [],
  "review_verdict": null,
  "error_info": null,
  "assigned_worker": "gemini_worker",
  "assigned_reviewer": "muse_reviewer",
  "metadata": {
    "execution_mode": "generate",
    "input_data": {
      "records": [
        {
          "region": "north",
          "sales": 40
        },
        {
          "region": "east",
          "sales": 20
        },
        {
          "region": "south",
          "sales": 30
        },
        {
          "region": "east",
          "sales": 10
        }
      ]
    }
  },
  "created_at": "2026-10-14T13:30:19.423852Z",
  "updated_at": "2026-10-14T13:30:19.423852Z"
}