{
  "schema_version": "1.0.0",
  "task_id": "task_n2_data_rollup01",
  "title": "Roll up regional sales records",
  "description": "Sort the input records by (region asc, sales asc) using the fixed records_transform_v1 template. Trusted expected output is computed independently by the control layer.",
  "acceptance_criteria": [
    "Trusted input records were provided",
    "Artifact content equals the expected sorted records"
  ],
  "priority": "high",
  "status": "created",
  "risk_assessment": {
    "risk_level": "read_only",
    "complexity": "low",
    "uncertainty": "low",
    "risk_basis": "Deterministic in-memory transform, no tools",
    "routing_basis": "N2 representative data task"
  },
  "budget": {"max_turns": 6, "max_tokens": 16000, "max_execution_time_seconds": 600},
  "context": {"workspace_root": "FILL_AT_SUBMIT", "target_files": []},
  "artifact_refs": [],
  "tool_execution_evidence": [],
  "review_verdict": null,
  "error_info": null,
  "assigned_worker": "gemini_worker",
  "assigned_reviewer": "muse_reviewer",
  "metadata": {
    "fixture_id": "n2-data-rollup/v1",
    "template_id": "records_transform_v1",
    "review_target_artifact_type": "code",
    "review_type_note": "Compat mapping: data_conversion artifacts are reviewed as code until a schema v1.1 adds data_conversion. See N2 spec.",
    "input_data": {"records": "see input.json (copied verbatim at submit time)"}
  },
  "created_at": "2026-10-14T00:00:00Z",
  "updated_at": "2026-10-14T00:00:00Z"
}
